{
  "name": "design-dna",
  "description": "Explicit-request-only skill for specific, source-authorized website design. Use only when the human asks for Design DNA; generic website, UI, review, and audit requests do not activate it.",
  "version": "13.6.1",
  "author": {
    "name": "Motty"
  },
  "license": "Proprietary",
  "keywords": [
    "web-design",
    "frontend",
    "art-direction",
    "creative-direction",
    "route-family",
    "design-review",
    "responsive-design",
    "connected-public-experience",
    "project-contrast",
    "direction-challenge",
    "non-generic"
  ]
}
